### ISSUE TITLE
pyexasol.ExaConnection.export_to_pandas(), .export_to_list(), .export_to_file() intermittent failures

### ISSUE THREAD

**Issue by Marcel-Zaripov** [badoo/pyexasol#68]
`pyexasol.ExaConnection.export_to_pandas()`, `.export_to_list()`, `.export_to_file()` may cause failures for long executing queries, when running on the setup with stateful firewalls and other functionality depending on connection tracking.

As far as it looks like, when running export, pyexasol starts a socket server in a separate process, which first sends out special TCP packet to which Exasol server responds with a proxy address and port (https://github.com/badoo/pyexasol/blob/master/pyexasol_utils/http_transport.py#L32). Then, this address and port from one of the exasol nodes is used in the `EXPORT` query (e.g. `EXPORT <SELECT * FROM TABLE> INTO CSV AT 'http://10.0.0.1:45223' FILE '000.gz`) and the result of it is later HTTP Streamed to that socket server by initialising it with a PUT request with `Transfer-Encoding: chunked` header set. That way pyexasol manages to circumvent firewall on the client side. Exasol does its magic on its side by proxying data from that node to the socket on the client side (IDK for sure, just guessing this part).

Tracing the network frames, we can see that after establishing TCP connection and getting the proxy address/port the connection is quiet until the query is executed and that PUT is sent (frame 773):
10.54.12.1 - client
10.0.0.1 - exasol
```
No. Time  Source  Destination Protocol  Length  Info
53  29.671637 10.54.12.1  10.0.0.1  TCP 74  33514 → 8888 [SYN] Seq=0 Win=65320 Len=0 MSS=1420 SACK_PERM=1 TSval=4107909024 TSecr=0 WS=128
54  29.672398 10.0.0.1  10.54.12.1  TCP 74  8888 → 33514 [SYN, ACK] Seq=0 Ack=1 Win=28160 Len=0 MSS=1420 SACK_PERM=1 TSval=3286892237 TSecr=4107909024 WS=128
55  29.672427 10.54.12.1  10.0.0.1  TCP 66  33514 → 8888 [ACK] Seq=1 Ack=1 Win=65408 Len=0 TSval=4107909025 TSecr=3286892237
56  29.672465 10.54.12.1  10.0.0.1  TCP 78  33514 → 8888 [PSH, ACK] Seq=1 Ack=1 Win=65408 Len=12 TSval=4107909025 TSecr=3286892237
57  29.672599 10.0.0.1  10.54.12.1  TCP 66  8888 → 33514 [ACK] Seq=1 Ack=13 Win=28160 Len=0 TSval=3286892237 TSecr=4107909025
58  29.673306 10.0.0.1  10.54.12.1  TCP 90  8888 → 33514 [PSH, ACK] Seq=1 Ack=13 Win=28160 Len=24 TSval=3286892237 TSecr=4107909025
59  29.673331 10.54.12.1  10.0.0.1  TCP 66  33514 → 8888 [ACK] Seq=13 Ack=25 Win=65408 Len=0 TSval=4107909025 TSecr=3286892237
773 288.024444  10.0.0.1  10.54.12.1  TCP 194 8888 → 33514 [PSH, ACK] Seq=25 Ack=13 Win=28160 Len=128 TSval=3286956825 TSecr=4107909025 [TCP segment of a reassembled PDU]
```

This TCP connection will be idle for us long as query executes.
Now this may cause issues for stateful firewalls somewhere in the middle that use some form of connection tracking when query runs longer than tracking timeout.

In our particular case, we faced this issue with GCP VPC Firewall, which implicitly allows all egress by default and denies ingress. Returning traffic is allowed for established connections, but after 600 seconds of idle time the connection information is dropped and this implicit deny kicks in. (https://cloud.google.com/compute/docs/troubleshooting/general-tips#communicatewithinternet) Since GCP Firewalls are implemented on the node via virtual switch, we do not have ability control timeouts on that side. Currently, we circumvent that by adding an allow ingress rule for TCP protocol on high ports.

This issue may also arise in either manual setup using Open vSwitch or netfilter/conntrack to provide Firewall, NAT, etc. E.g. sNAT-ing kubernetes pods may be stateful.

It would be nice to set following options on the socket:
```
socket.setsockopt(socket.SOL_SOCKET, socket.SO_KEEPALIVE, 1)
socket.setsockopt(socket.IPPROTO_TCP, socket.TCP_KEEPIDLE, idle_timeout)
```

Where, idle_timeout is some value under 600, since it is a default value for `nf_conntrack_generic_timeout` in linux kernel. The default interval and number of probes actually works fine with default conntrack values, I suppose with other connection tracking implementations too.

It could be also an optionally setable value from the ExaConnection level to enable keepalive on the export socket and set the idle timeout, interval, etc.

Thank you very much!

**Comment by wildraid** [comment]
Yep, it makes perfect sense.

The only problem I see here is related to potential compatibility issues. It looks like not every socket option is available on every combination of OS + hardware. For example, this is what `websocket-client` is doing: https://github.com/websocket-client/websocket-client/blob/b1643d2ca78f14316f92f3fa86e236c5db88eacd/websocket/_socket.py#L38

And I could not find any clear documentation regarding to availability and compatibility of these options.

If you have some time to spare, could you try to add these options as Pull Request and test it at least on Linux, MacOS and Windows? You may add it right before the `self.socket.connect(self.server_address)`, it should work just fine.

I can do it too, but it might take a few weeks before I have time to setup and test various configurations, especially Windows.

Thank you!

**Comment by wildraid** [comment]
@Marcel-Zaripov , please check this commit with draft implementation: https://github.com/badoo/pyexasol/commit/ce1dfc3c216489b25f5322c2303a0e80c783047c

As I thought, TCP keep-alive settings are OS-dependent. But I've managed to find some good examples.

Also, I did not add new parameters to functions and used some reasonable defaults instead. Hopefully, we will be able to get aways with this. The main problems with having an extra parameter:

1. Windows is special, it uses `.ioctl()` instead of `.setsockopt()`.
2. It must be added not only to `pyexasol.connect()`, but also to `pyexasol.http_transport()`.

It complicates things a lot. Maybe we do not really need it.

**Comment by Marcel-Zaripov** [comment]
@wildraid 
Thank you very much for addressing this!

This does look good and I agree that sensible defaults make passing those as parameters redundant. Can definitely live without it.

**Comment by wildraid** [comment]
@Marcel-Zaripov , version `0.18.0` is now live.

Let's see how it goes :)

**Comment by wildraid** [comment]
@Marcel-Zaripov , if it is possible, could you please re-test the latest version and see if it helped in practice.

If it did, I'll close the issue. It's not urgent, no rush.

Thank you.
